{
    "ok": true,
    "dataQualityStatus": "available",
    "data": [
        {
            "symbol": "510300",
            "name": "沪深300ETF",
            "market": "A",
            "assetClass": "equity",
            "currency": "CNY",
            "source": "akshare",
            "metadata": {
                "externalInstrumentId": "akshare:A:510300"
            }
        }
    ],
    "providerStatus": {
        "attemptedProviders": [
            "akshare"
        ]
    },
    "maintenanceStatus": {
        "running": false,
        "queuedTasks": 0
    },
    "resultProvenance": {
        "attemptedProviders": [
            "akshare"
        ],
        "fetchedAt": "2026-05-16T00:00:00.000Z",
        "warnings": []
    }
}